{
  "schema_version": "1.0",
  "trace_id": "tr_demo_001",
  "workflow_name": "support_refund",
  "environment": "staging",
  "actor": {
    "actor_id": "user_42",
    "actor_type": "user",
    "display_name": "Alex Chen"
  },
  "permission_snapshot": {
    "policy_version": "2026.05.1",
    "roles": ["support_agent"],
    "scopes": ["refunds:approve"],
    "resource_ids": ["ord_123"],
    "denied_resources": [],
    "captured_at": "2026-05-19T14:31:55Z"
  },
  "started_at": "2026-05-19T14:31:55Z",
  "status": "completed",
  "tags": { "channel": "chat" },
  "spans": [
    {
      "span_id": "span_root",
      "name": "refund_flow",
      "events": [
        {
          "schema_version": "1.0",
          "event_id": "evt_prompt_001",
          "type": "prompt",
          "occurred_at": "2026-05-19T14:31:58Z",
          "span_id": "span_root",
          "payload": {
            "messages": [{ "role": "user", "content": "Approve refund for order ord_123" }],
            "model": "gpt-4.1"
          }
        },
        {
          "schema_version": "1.0",
          "event_id": "evt_tool_001",
          "type": "tool_call",
          "occurred_at": "2026-05-19T14:32:01Z",
          "span_id": "span_root",
          "payload": {
            "tool_name": "create_refund",
            "input": { "order_id": "ord_123", "amount": 50 },
            "output": { "status": "approved", "refund_id": "rf_456" }
          }
        }
      ]
    }
  ]
}
